Site Code,Site Name,Latitude,Longitude,COLLECTION_SYSTEM,collection_sys_description,MasterStationID,MasterStationName,CollectionStationName,RETRIES,SEQ_NO,COMMENTS,LAT,LON,STATION_TYPE,COMMON_DESC,DIVERTING_WORKS,MEASURING_DEVICE,RECORD_RATING,SYSTEM_NAME,UNITS_ID,OWNER_NAME,CAPTURE_SEQ_NO,ANALOG_CHANNEL,LOW_FLOW,HIGH_FLOW,DEVICE_TYPE,OWNER_PHONE,REALTIME_INCLUDE,CORRECTED_DATA,STATUS,SYSTEM_GROUP,SYSTEM_SUBGROUP,ADDRESS_ID,DataEntryMethod,DataLogger,DatasetType,SeriesVerifiedBy,SeriesVerifiedDate,SiteState,SiteType,SiteVerifiedBy,SiteVerifiedDate,Telemetry
09312000,"NORTH FORK WHITE RIVER NEAR SOLDIER SUMMIT, UTAH",39.93329157,-111.0673886,,,,,,,,,,,,,,,,,,,,,,,,,,,,,,,,,,,,,,,,
09312500,"WHITE RIVER NEAR SOLDIER SUMMIT, UTAH",39.9221807,-111.057666,,,,,,,,,,,,,,,,,,,,,,,,,,,,,,,,,,,,,,,,
09312600,"WHITE R BL TABBYUNE CRK NR SOLDIER SUMMIT, UT",39.87601667,-111.0375167,,,,,,,,,,,,,,,,,,,,,,,,,,,,,,,,,,,,,,,,
09312700,"BEAVER CREEK NEAR SOLDIER SUMMIT, UTAH",39.8305162,-110.9693302,,,,,,,,,,,,,,,,,,,,,,,,,,,,,,,,,,,,,,,,
09312800,"WILLOW CREEK NEAR CASTLE GATE, UTAH",39.7769068,-110.7923812,,,,,,,,,,,,,,,,,,,,,,,,,,,,,,,,,,,,,,,,
09312900,"WILLOW CREEK AT CASTLE GATE, UTAH",39.7269074,-110.8621056,,,,,,,,,,,,,,,,,,,,,,,,,,,,,,,,,,,,,,,,
09313000,"PRICE RIVER NEAR HEINER, UTAH",39.71885199,-110.8659946,,,,,,,,,,,,,,,,,,,,,,,,,,,,,,,,,,,,,,,,
09313040,"SPRING CANYON BELOW SOWBELLY GULCH AT HELPER, UT",39.68857466,-110.8865507,,,,,,,,,,,,,,,,,,,,,,,,,,,,,,,,,,,,,,,,
09313500,"PRICE RIVER NEAR HELPER, UTAH",39.65135309,-110.8576609,,,,,,,,,,,,,,,,,,,,,,,,,,,,,,,,,,,,,,,,
09313520,"PRICE RIVER BELOW GOLF COURSE NEAR HELPER, UT",39.6373833,-110.8577722,,,,,,,,,,,,,,,,,,,,,,,,,,,,,,,,,,,,,,,,
09313965,"COAL CREEK NEAR HELPER, UTAH",39.7024637,-110.6779354,,,,,,,,,,,,,,,,,,,,,,,,,,,,,,,,,,,,,,,,
09313975,"SOLDIER CREEK BL MINE NR WELLINGTON, UTAH",39.69524168,-110.6151575,,,,,,,,,,,,,,,,,,,,,,,,,,,,,,,,,,,,,,,,
09313985,"DUGOUT CREEK NEAR SUNNYSIDE, UTAH",39.6794086,-110.5504348,,,,,,,,,,,,,,,,,,,,,,,,,,,,,,,,,,,,,,,,
09314000,"PRICE RIVER BL COAL CREEK NR WELLINGTON, UTAH",39.51107739,-110.6812667,,,,,,,,,,,,,,,,,,,,,,,,,,,,,,,,,,,,,,,,
09314250,"PRICE RIVER BL MILLER CREEK NR WELLINGTON, UT",39.4496897,-110.6279338,,,,,,,,,,,,,,,,,,,,,,,,,,,,,,,,,,,,,,,,
09314280,"DESERT SEEP WASH NEAR WELLINGTON, UTAH",39.4210793,-110.6462682,,,,,,,,,,,,,,,,,,,,,,,,,,,,,,,,,,,,,,,,
09314340,"GRASSY TRAIL CREEK AT SUNNYSIDE, UTAH",39.55552196,-110.3801549,,,,,,,,,,,,,,,,,,,,,,,,,,,,,,,,,,,,,,,,
09314374,"HORSE CANYON NR. SUNNYSIDE, UT.",39.4571899,-110.3598773,,,,,,,,,,,,,,,,,,,,,,,,,,,,,,,,,,,,,,,,
09314500,"PRICE RIVER AT WOODSIDE, UT",39.26444444,-110.3427778,,,,,,,,,,,,,,,,,,,,,,,,,,,,,,,,,,,,,,,,
09315000,"GREEN RIVER AT GREEN RIVER, UT",38.9860831,-110.1512475,,,,,,,,,,,,,,,,,,,,,,,,,,,,,,,,,,,,,,,,
09315005,COLORADO RIVER PLUS GREEN RIVER (TEMP),38.98636088,-110.1515253,,,,,,,,,,,,,,,,,,,,,,,,,,,,,,,,,,,,,,,,
09315500,"SALERATUS WASH AT GREEN RIVER, UTAH",38.9813617,-110.2468077,,,,,,,,,,,,,,,,,,,,,,,,,,,,,,,,,,,,,,,,
09316000,"BROWNS WASH NEAR GREEN RIVER, UTAH",38.98608294,-110.1298576,,,,,,,,,,,,,,,,,,,,,,,,,,,,,,,,,,,,,,,,
09316100,"FLOYWASH@HIGHWAY BRIDGE 6&50 NEAR GREEN RIVER,UT",38.92330555,-109.9423497,,,,,,,,,,,,,,,,,,,,,,,,,,,,,,,,,,,,,,,,
09317000,"BOULGER CREEK NEAR FAIRVIEW, UTAH",39.6332965,-111.2673981,,,,,,,,,,,,,,,,,,,,,,,,,,,,,,,,,,,,,,,,
09317500,"CANDLAND DITCH NEAR MT PLEASANT, UTAH",39.549964,-111.317401,,,,,,,,,,,,,,,,,,,,,,,,,,,,,,,,,,,,,,,,
09317800,"ELECTRIC LAKE NEAR SCOFIELD, UT",39.6007973,-111.2121177,,,,,,,,,,,,,,,,,,,,,,,,,,,,,,,,,,,,,,,,
09317919,"CRANDALL CANYON AT MOUTH NR HUNTINGTON, UT",39.4632993,-111.1490597,,,,,,,,,,,,,,,,,,,,,,,,,,,,,,,,,,,,,,,,
09317920,"TIE FORK CANYON NEAR HUNTINGTON, UTAH",39.45857719,-111.137115,,,,,,,,,,,,,,,,,,,,,,,,,,,,,,,,,,,,,,,,
09317997,"HUNTINGTON CREEK NEAR HUNTINGTON, UT",39.3852446,-111.0882249,,,,,,,,,,,,,,,,,,,,,,,,,,,,,,,,,,,,,,,,
09318000,"HUNTINGTON CREEK NR HUNTINGTON, UTAH",39.37135608,-111.0637799,,,,,,,,,,,,,,,,,,,,,,,,,,,,,,,,,,,,,,,,
09318500,"HUNTINGTON CREEK NEAR CASTLE DALE, UTAH",39.2083045,-110.9173887,,,,,,,,,,,,,,,,,,,,,,,,,,,,,,,,,,,,,,,,
09319000,"EPHRAIM TUNNEL NEAR EPHRAIM, UT",39.3296855,-111.4315745,,,,,,,,,,,,,,,,,,,,,,,,,,,,,,,,,,,,,,,,
09319001,EPHRAIM TUNNEL SUPPLEMENTAL DATA,39.3296855,-111.4315745,,,,,,,,,,,,,,,,,,,,,,,,,,,,,,,,,,,,,,,,
09320000,"HORSESHOE TUNNEL NEAR EPHRAIM, UTAH",39.36662986,-111.4507426,,,,,,,,,,,,,,,,,,,,,,,,,,,,,,,,,,,,,,,,
09320500,"LARSEN TUNNEL NEAR EPHRAIM, UTAH",39.34996316,-111.4507426,,,,,,,,,,,,,,,,,,,,,,,,,,,,,,,,,,,,,,,,
09321000,"COAL FORK DITCH NEAR MT PLEASANT, UTAH",39.4999647,-111.3174006,,,,,,,,,,,,,,,,,,,,,,,,,,,,,,,,,,,,,,,,
09321500,"TWIN CREEK TUNNEL NEAR MT PLEASANT, UTAH",39.46663114,-111.3340682,,,,,,,,,,,,,,,,,,,,,,,,,,,,,,,,,,,,,,,,
09322000,"BLACK CANYON DITCH NEAR SPRING CITY, UTAH",39.4499644,-111.334068,,,,,,,,,,,,,,,,,,,,,,,,,,,,,,,,,,,,,,,,
09322500,"CEDAR CREEK TUNNEL NEAR SPRING CITY, UTAH",39.4499644,-111.334068,,,,,,,,,,,,,,,,,,,,,,,,,,,,,,,,,,,,,,,,
09323000,"SPRING CITY TUNNEL NEAR SPRING CITY, UT",39.4260752,-111.3649034,,,,,,,,,,,,,,,,,,,,,,,,,,,,,,,,,,,,,,,,
09323500,"REEDER DITCH NEAR SPRING CITY, UTAH",39.38329715,-111.3840712,,,,,,,,,,,,,,,,,,,,,,,,,,,,,,,,,,,,,,,,
09323900,"JOES VALLEY RESERVOIR NEAR ORANGEVILLE, UT",39.28885345,-111.2701732,,,,,,,,,,,,,,,,,,,,,,,,,,,,,,,,,,,,,,,,
09324000,"SEELY CREEK NEAR ORANGEVILLE, UTAH",39.2832979,-111.2673951,,,,,,,,,,,,,,,,,,,,,,,,,,,,,,,,,,,,,,,,
09324200,"CTNWD C AB STRAIGHT CANYON NR ORANGEVILLE, UT",39.307188,-111.1846153,,,,,,,,,,,,,,,,,,,,,,,,,,,,,,,,,,,,,,,,
09324500,"COTTONWOOD CREEK NEAR ORANGEVILLE, UTAH",39.26663339,-111.1298922,,,,,,,,,,,,,,,,,,,,,,,,,,,,,,,,,,,,,,,,
09325000,"COTTONWOOD CREEK NEAR CASTLE DALE, UTAH",39.16997188,-110.9382224,,,,,,,,,,,,,,,,,,,,,,,,,,,,,,,,,,,,,,,,
09325100,"SAN RAFAEL R ABOVE FERRON CR NR CASTLE DALE, UT",39.14997269,-110.909055,,,,,,,,,,,,,,,,,,,,,,,,,,,,,,,,,,,,,,,,
09325500,"JOHN AUGUST DITCH NEAR EPHRAIM, UTAH",39.29996304,-111.4507425,,,,,,,,,,,,,,,,,,,,,,,,,,,,,,,,,,,,,,,,
09326000,"MADSEN DITCH NEAR EPHRAIM, UTAH",39.31662975,-111.4507426,,,,,,,,,,,,,,,,,,,,,,,,,,,,,,,,,,,,,,,,
09326500,"FERRON CREEK (UPPER STATION) NEAR FERRON, UT",39.1049972,-111.2289917,,,,,,,,,,,,,,,,,,,,,,,,,,,,,,,,,,,,,,,,
09327000,"FERRON CR BL MILLSITE RES & DIVS NR FERRON, UT",39.09526389,-111.1788694,,,,,,,,,,,,,,,,,,,,,,,,,,,,,,,,,,,,,,,,
09327500,"FERRON CREEK NEAR CASTLE DALE, UT",39.1055281,-111.0243349,,,,,,,,,,,,,,,,,,,,,,,,,,,,,,,,,,,,,,,,
09327550,"FERRON CREEK BL PARADISE RANCH NR CLAWSON, UT",39.11913926,-110.9896123,,,,,,,,,,,,,,,,,,,,,,,,,,,,,,,,,,,,,,,,
09328000,"SAN RAFAEL RIVER NEAR CASTLE DALE, UTAH",39.1382333,-110.89065,,,,,,,,,,,,,,,,,,,,,,,,,,,,,,,,,,,,,,,,
09328100,"SAN RAFAEL R AT SAN R BR CAMPGROUND NR C DALE,UT",39.0808086,-110.6662723,,,,,,,,,,,,,,,,,,,,,,,,,,,,,,,,,,,,,,,,
09328400,"San Rafael River below I-70 near Green River, Utah",38.90886338,-110.3826485,,,,,,,,,,,,,,,,,,,,,,,,,,,,,,,,,,,,,,,,
09328500,"SAN RAFAEL RIVER NEAR GREEN RIVER, UT",38.8583081,-110.3701469,,,,,,,,,,,,,,,,,,,,,,,,,,,,,,,,,,,,,,,,
09328910,"SAN RAFAEL RIVER AT MOUTH NEAR GREEN RIVER, UT",38.7577611,-110.1435278,,,,,,,,,,,,,,,,,,,,,,,,,,,,,,,,,,,,,,,,
09328920,GREEN RIVER AT MINERAL BOTTOM NR CYNLNDS NTL PARK,38.52402778,-109.9944167,,,,,,,,,,,,,,,,,,,,,,,,,,,,,,,,,,,,,,,,
09328960,"COLORADO RIVER AT GYPSUM CANYON NEAR HITE, UT",38.01001944,-110.0735389,,,,,,,,,,,,,,,,,,,,,,,,,,,,,,,,,,,,,,,,
09328990,"COLORADO RIVER AB DIRTY DEVIL RIVER NR HITE, UT",37.89146944,-110.3708361,,,,,,,,,,,,,,,,,,,,,,,,,,,,,,,,,,,,,,,,
09329000,"FREMONT RIVER BELOW FISH LAKE, UTAH",38.591642,-111.6757425,,,,,,,,,,,,,,,,,,,,,,,,,,,,,,,,,,,,,,,,
09329050,"SEVEN MILE CREEK NEAR FISH LAKE, UT",38.62775234,-111.6479647,,,,,,,,,,,,,,,,,,,,,,,,,,,,,,,,,,,,,,,,
09329500,"FREMONT RIVER NEAR FREMONT, UTAH",38.4852555,-111.5768487,,,,,,,,,,,,,,,,,,,,,,,,,,,,,,,,,,,,,,,,
09329900,"PINE CREEK NEAR BICKNELL, UTAH",38.26942574,-111.5840716,,,,,,,,,,,,,,,,,,,,,,,,,,,,,,,,,,,,,,,,
09330000,"FREMONT RIVER NEAR BICKNELL, UT",38.3069248,-111.5187917,,,,,,,,,,,,,,,,,,,,,,,,,,,,,,,,,,,,,,,,
09330210,"PLEASANT CREEK NEAR CAINEVILLE, UTAH",38.27220246,-111.0923876,,,,,,,,,,,,,,,,,,,,,,,,,,,,,,,,,,,,,,,,
09330230,"FREMONT RIVER NEAR CAINEVILLE, UT",38.2791469,-111.0657201,,,,,,,,,,,,,,,,,,,,,,,,,,,,,,,,,,,,,,,,
09330410,"BULL CREEK NEAR HANKSVILLE, UT",38.12192936,-110.7595973,,,,,,,,,,,,,,,,,,,,,,,,,,,,,,,,,,,,,,,,
09330500,"MUDDY CREEK NEAR EMERY, UT",38.99105556,-111.253886,,,,,,,,,,,,,,,,,,,,,,,,,,,,,,,,,,,,,,,,
09331500,"IVIE CREEK ABOVE DIVERSIONS NR EMERY, UTAH",38.7583077,-111.4215683,,,,,,,,,,,,,,,,,,,,,,,,,,,,,,,,,,,,,,,,
09331850,"CONVULSION CANYON NEAR EMERY, UTAH",38.906361,-111.411847,,,,,,,,,,,,,,,,,,,,,,,,,,,,,,,,,,,,,,,,
09331900,"QUITCHUPAH CREEK NEAR EMERY, UTAH",38.8591422,-111.2621149,,,,,,,,,,,,,,,,,,,,,,,,,,,,,,,,,,,,,,,,
09331950,"CHRISTIANSEN WASH NEAR EMERY, UTAH",38.8613646,-111.2526699,,,,,,,,,,,,,,,,,,,,,,,,,,,,,,,,,,,,,,,,
09332100,"MUDDY CREEK BL I-70 NR EMERY, UTAH",38.8125833,-111.20025,,,,,,,,,,,,,,,,,,,,,,,,,,,,,,,,,,,,,,,,
09332500,"MUDDY CREEK BELOW IVIE CREEK NR EMERY, UTAH",38.76664226,-111.1293347,,,,,,,,,,,,,,,,,,,,,,,,,,,,,,,,,,,,,,,,
09332600,"Muddy Creek at Tomsich Butte nr Hanksville, UT",38.68694444,-110.9995278,,,,,,,,,,,,,,,,,,,,,,,,,,,,,,,,,,,,,,,,
09332700,"MUDDY CREEK AT DELTA MINE NR HANKSVILLE, UTAH",38.5630341,-110.9543267,,,,,,,,,,,,,,,,,,,,,,,,,,,,,,,,,,,,,,,,
09333000,"DIRTY DEVIL RIVER NEAR HANKSVILLE, UTAH",38.39998208,-110.6840379,,,,,,,,,,,,,,,,,,,,,,,,,,,,,,,,,,,,,,,,
09333500,DIRTY DEVIL R AB POISON SP WSH NR HANKSVILLE UT,38.0971222,-110.4074167,,,,,,,,,,,,,,,,,,,,,,,,,,,,,,,,,,,,,,,,
09334000,"NORTH WASH NEAR HANKSVILLE (HITE), UTAH",37.8985992,-110.4493091,,,,,,,,,,,,,,,,,,,,,,,,,,,,,,,,,,,,,,,,
09334500,WHITE CANYON NEAR HANKSVILLE UTAH,37.79860026,-110.3765285,,,,,,,,,,,,,,,,,,,,,,,,,,,,,,,,,,,,,,,,
09335000,"COLORADO RIVER AT HITE, UTAH",37.8083222,-110.4493082,,,,,,,,,,,,,,,,,,,,,,,,,,,,,,,,,,,,,,,,
09335200,"BULLFROG CREEK NEAR BULLFROG, UTAH",37.7708229,-110.8459839,,,,,,,,,,,,,,,,,,,,,,,,,,,,,,,,,,,,,,,,
09335500,"NORTH CREEK NEAR ESCALANTE, UTAH",37.76665536,-111.6840664,,,,,,,,,,,,,,,,,,,,,,,,,,,,,,,,,,,,,,,,
09336000,"BIRCH CREEK NEAR ESCALANTE, UTAH",37.76248885,-111.738235,,,,,,,,,,,,,,,,,,,,,,,,,,,,,,,,,,,,,,,,
09336500,"BIRCH CREEK AT MOUTH NEAR ESCALANTE, UT",37.76665536,-111.6840664,,,,,,,,,,,,,,,,,,,,,,,,,,,,,,,,,,,,,,,,
09337000,"PINE CREEK NEAR ESCALANTE, UT",37.86248747,-111.6360113,,,,,,,,,,,,,,,,,,,,,,,,,,,,,,,,,,,,,,,,
09337500,"ESCALANTE RIVER NEAR ESCALANTE, UT",37.77804389,-111.5746181,,,,,,,,,,,,,,,,,,,,,,,,,,,,,,,,,,,,,,,,
09338000,"EAST FORK BOULDER CREEK NEAR BOULDER, UTAH",38.0419293,-111.450174,,,,,,,,,,,,,,,,,,,,,,,,,,,,,,,,,,,,,,,,
09338500,"EAST FORK DEER CREEK NEAR BOULDER, UTAH",38.00137464,-111.3896157,,,,,,,,,,,,,,,,,,,,,,,,,,,,,,,,,,,,,,,,
09338900,"DEER CREEK NEAR BOULDER, UT",37.85332098,-111.3551679,,,,,,,,,,,,,,,,,,,,,,,,,,,,,,,,,,,,,,,,
09339000,"BOULDER CREEK NEAR BOULDER, UT",37.78193297,-111.360167,,,,,,,,,,,,,,,,,,,,,,,,,,,,,,,,,,,,,,,,
09339500,"ESCALANTE RIVER AT MOUTH NEAR ESCALANTE, UTAH",37.3141585,-110.9034837,,,,,,,,,,,,,,,,,,,,,,,,,,,,,,,,,,,,,,,,
09372200,"MCELMO CREEK NEAR BLUFF, UTAH",37.21888889,-109.1904111,,,,,,,,,,,,,,,,,,,,,,,,,,,,,,,,,,,,,,,,
09372400,"NORTH CREEK NEAR MONTICELLO, UT",37.87666,-109.4459538,,,,,,,,,,,,,,,,,,,,,,,,,,,,,,,,,,,,,,,,
09372500,"N.FORK MOUNTEZUMA CR. AT MONTICELLO,UT.",37.86666057,-109.36734,,,,,,,,,,,,,,,,,,,,,,,,,,,,,,,,,,,,,,,,
09376800,"SPRING CREEK NEAR MONTICELLO, UT",37.88888196,-109.46651,,,,,,,,,,,,,,,,,,,,,,,,,,,,,,,,,,,,,,,,
09376900,"SPRING CREEK ABV DIVERSIONS, NR MONTICELLO, UTAH",37.91943726,-109.4348421,,,,,,,,,,,,,,,,,,,,,,,,,,,,,,,,,,,,,,,,
09378100,"NORTH CREEK ABV. RANGER STAT NR MONTICELLO, UTAH",37.87304937,-109.3665067,,,,,,,,,,,,,,,,,,,,,,,,,,,,,,,,,,,,,,,,
09378170,"SOUTH CREEK ABOVE RESERVOIR NEAR MONTICELLO, UT",37.8466608,-109.3695625,,,,,,,,,,,,,,,,,,,,,,,,,,,,,,,,,,,,,,,,
09378200,"MONTEZUMA CREEK AT GOLF COURSE AT MONTICELLO, UT",37.86054967,-109.3423393,,,,,,,,,,,,,,,,,,,,,,,,,,,,,,,,,,,,,,,,
09378600,"MONTEZUMA CREEK NEAR BLUFF, UTAH",37.2716111,-109.3286,,,,,,,,,,,,,,,,,,,,,,,,,,,,,,,,,,,,,,,,
09378630,"RECAPTURE CREEK NEAR BLANDING, UT",37.7555504,-109.476511,,,,,,,,,,,,,,,,,,,,,,,,,,,,,,,,,,,,,,,,
09378650,"RECAPTURE CR BL JOHNSON CR NR BLANDING,UT.",37.6808299,-109.4626212,,,,,,,,,,,,,,,,,,,,,,,,,,,,,,,,,,,,,,,,
09378700,COTTONWOOD WASH NR BLANDING UTAH,37.5605543,-109.5787353,,,,,,,,,,,,,,,,,,,,,,,,,,,,,,,,,,,,,,,,
09379000,"COMB WASH NEAR BLUFF, UTAH",37.26611234,-109.6756784,,,,,,,,,,,,,,,,,,,,,,,,,,,,,,,,,,,,,,,,
09379250,"CHINLE CREEK AT MOUTH NEAR BLUFF,  UTAH",37.19991667,-109.7106389,,,,,,,,,,,,,,,,,,,,,,,,,,,,,,,,,,,,,,,,
09379500,"SAN JUAN RIVER NEAR BLUFF, UT",37.15067778,-109.8666889,,,,,,,,,,,,,,,,,,,,,,,,,,,,,,,,,,,,,,,,
09379700,"SAN JUAN R BL PIUTE FARMS WASH NR MONUMENT VLY, UT",37.25265278,-110.4389694,,,,,,,,,,,,,,,,,,,,,,,,,,,,,,,,,,,,,,,,
09381000,"HENRIEVILLE CREEK NEAR HENRIEVILLE, UT",37.5708183,-111.9715749,,,,,,,,,,,,,,,,,,,,,,,,,,,,,,,,,,,,,,,,
09381500,"PARIA RIVER NEAR CANNONVILLE, UT",37.48109556,-112.0215756,,,,,,,,,,,,,,,,,,,,,,,,,,,,,,,,,,,,,,,,
09381800,"PARIA RIVER NEAR KANAB, UTAH",37.10748428,-111.9060102,,,,,,,,,,,,,,,,,,,,,,,,,,,,,,,,,,,,,,,,
09403600,"KANAB CREEK NEAR KANAB, UT",37.10054059,-112.5479827,,,,,,,,,,,,,,,,,,,,,,,,,,,,,,,,,,,,,,,,
09403620,"MILL CREEK ABOVE STUDY AREA NR GLENDALE,UT.",37.36359328,-112.3424221,,,,,,,,,,,,,,,,,,,,,,,,,,,,,,,,,,,,,,,,
09403630,"SKUTUMPAH CR. BL STUDY AREA NR GLENDALE,UT.",37.32164845,-112.3276987,,,,,,,,,,,,,,,,,,,,,,,,,,,,,,,,,,,,,,,,
09403640,"INTERMEDIATE DRAINAGE NR. GLENDALE, UT.",37.3027596,-112.3454772,,,,,,,,,,,,,,,,,,,,,,,,,,,,,,,,,,,,,,,,
09403650,"THOMPSON CREEK ABV STUDY AREA NR GLENDALE, UTAH",37.33637115,-112.3727012,,,,,,,,,,,,,,,,,,,,,,,,,,,,,,,,,,,,,,,,
09403660,"THOMPSON CREEK BLW STUDY AREA NR GLENDALE, UTAH",37.30275965,-112.3468662,,,,,,,,,,,,,,,,,,,,,,,,,,,,,,,,,,,,,,,,
09403670,THOMPSON CREEK NEAR GLENDALE,37.29581524,-112.3526997,,,,,,,,,,,,,,,,,,,,,,,,,,,,,,,,,,,,,,,,
09403690,"JOHNSON WASH ABOVE FLOOD CANYON NEAR KANAB, UT",37.1272063,-112.390755,,,,,,,,,,,,,,,,,,,,,,,,,,,,,,,,,,,,,,,,
09404450,"EAST FORK VIRGIN RIVER NEAR GLENDALE, UT",37.3394272,-112.6043769,,,,,,,,,,,,,,,,,,,,,,,,,,,,,,,,,,,,,,,,
09404700,"EAST FK VIRGIN RIVER NR MOUNT CARMEL JUNCTION, UT",37.20831725,-112.6885434,,,,,,,,,,,,,,,,,,,,,,,,,,,,,,,,,,,,,,,,
09404900,"EAST FORK VIRGIN RIVER NEAR SPRINGDALE, UT",37.16414955,-112.9585499,,,,,,,,,,,,,,,,,,,,,,,,,,,,,,,,,,,,,,,,
09405200,"DEEP CREEK NEAR CEDAR CITY, UT",37.52164478,-112.8843876,,,,,,,,,,,,,,,,,,,,,,,,,,,,,,,,,,,,,,,,
09405250,"EAST FORK DEEP CREEK NR CEDAR CITY, UT",37.5097004,-112.8835542,,,,,,,,,,,,,,,,,,,,,,,,,,,,,,,,,,,,,,,,
09405300,"CRYSTAL CREEK NEAR CEDAR CITY, UTAH",37.52219969,-113.0243916,,,,,,,,,,,,,,,,,,,,,,,,,,,,,,,,,,,,,,,,
09405400,"NF VIRGIN RIVER NEAR GLENDALE, UTAH",37.47275734,-112.7785503,,,,,,,,,,,,,,,,,,,,,,,,,,,,,,,,,,,,,,,,
09405420,N FK VIRGIN R BLW BULLOCH CANYON NR GLENDALE,37.41831366,-112.8004945,,,,,,,,,,,,,,,,,,,,,,,,,,,,,,,,,,,,,,,,
09405450,N FK VIRGIN R ABV ZION NARROWS NR GLENDALE,37.39053617,-112.8257725,,,,,,,,,,,,,,,,,,,,,,,,,,,,,,,,,,,,,,,,
09405490,"NORTH FORK VIRGIN R. AB BIG BEND NR SPRINGDALE, UT",37.27859285,-112.9446625,,,,,,,,,,,,,,,,,,,,,,,,,,,,,,,,,,,,,,,,
09405499,"SPRINGDALE CANAL NR. SPRINGDALE, UT",37.21164904,-112.9766067,,,,,,,,,,,,,,,,,,,,,,,,,,,,,,,,,,,,,,,,
09405500,"NORTH FORK VIRGIN RIVER NEAR SPRINGDALE, UT",37.2097046,-112.9785512,,,,,,,,,,,,,,,,,,,,,,,,,,,,,,,,,,,,,,,,
09405501,"NORTH FORK VIRGIN RIVER NR SPRINGDALE, UT",37.2097046,-112.9785512,,,,,,,,,,,,,,,,,,,,,,,,,,,,,,,,,,,,,,,,
09405900,"NORTH CREEK NEAR VIRGIN, UT",37.23720465,-113.151056,,,,,,,,,,,,,,,,,,,,,,,,,,,,,,,,,,,,,,,,
09406000,"VIRGIN RIVER AT VIRGIN, UT",37.2041494,-113.1807789,,,,,,,,,,,,,,,,,,,,,,,,,,,,,,,,,,,,,,,,
09406100,"VIRGIN RIVER AB LA VERKIN CREEK NR LA VERKIN, UT",37.1969272,-113.285226,,,,,,,,,,,,,,,,,,,,,,,,,,,,,,,,,,,,,,,,
09406150,"LA VERKIN CREEK NEAR LA VERKIN, UTAH",37.20470494,-113.2849483,,,,,,,,,,,,,,,,,,,,,,,,,,,,,,,,,,,,,,,,
09406300,"KANARRA CREEK AT KANARRAVILLE, UTAH",37.53803416,-113.1685608,,,,,,,,,,,,,,,,,,,,,,,,,,,,,,,,,,,,,,,,
09406500,"ASH CREEK NEAR NEW HARMONY, UT",37.41248085,-113.2368937,,,,,,,,,,,,,,,,,,,,,,,,,,,,,,,,,,,,,,,,
09406600,"ASH CREEK RESERVOIR NEAR NEW HARMONY, UT",37.4105364,-113.2355047,,,,,,,,,,,,,,,,,,,,,,,,,,,,,,,,,,,,,,,,
09406640,"LEAP CREEK BELOW MAPLE HOLLOW, NEAR PINTURA, UT",37.38331434,-113.2941168,,,,,,,,,,,,,,,,,,,,,,,,,,,,,,,,,,,,,,,,
09406700,"SOUTH ASH CREEK BELOW MILL CREEK NEAR PINTURA, UT",37.36386986,-113.3343953,,,,,,,,,,,,,,,,,,,,,,,,,,,,,,,,,,,,,,,,
09406900,"WET SANDY CREEK NEAR PINTURA, UT",37.3241479,-113.3571732,,,,,,,,,,,,,,,,,,,,,,,,,,,,,,,,,,,,,,,,
09407000,"ASH CREEK ABOVE TOQUERVILLE, UTAH",37.26664895,-113.2793929,,,,,,,,,,,,,,,,,,,,,,,,,,,,,,,,,,,,,,,,
09407150,"WEST FIELD DITCH AT TOQUERVILLE, UT",37.2608157,-113.2757816,,,,,,,,,,,,,,,,,,,,,,,,,,,,,,,,,,,,,,,,
09407200,"ASH CR BLW WEST FIELD DITCH AT TOQUERVILLE, UT",37.2658156,-113.2813374,,,,,,,,,,,,,,,,,,,,,,,,,,,,,,,,,,,,,,,,
09407201,"ASH CR BELOW DIVERSION DAM, AT TOQUERVILLE, UT",37.2605379,-113.2757816,,,,,,,,,,,,,,,,,,,,,,,,,,,,,,,,,,,,,,,,
09407600,"ASH CREEK NEAR TOQUERVILLE, UT",37.23248254,-113.284115,,,,,,,,,,,,,,,,,,,,,,,,,,,,,,,,,,,,,,,,
09407800,"ASH CREEK NEAR LA VERKIN, UT",37.20553826,-113.2868928,,,,,,,,,,,,,,,,,,,,,,,,,,,,,,,,,,,,,,,,
09407810,"VIRGIN RIVER BELOW ASH CREEK NR LAVERKIN, UT",37.20192714,-113.2916151,,,,,,,,,,,,,,,,,,,,,,,,,,,,,,,,,,,,,,,,
09408000,"LEEDS CREEK NEAR LEEDS, UT",37.26748174,-113.3707839,,,,,,,,,,,,,,,,,,,,,,,,,,,,,,,,,,,,,,,,
09408135,"VIRGIN RIVER AB QUAIL CREEK NEAR HURRICANE, UT",37.19248238,-113.3532832,,,,,,,,,,,,,,,,,,,,,,,,,,,,,,,,,,,,,,,,
09408150,"VIRGIN RIVER NEAR HURRICANE, UT",37.16276007,-113.3952285,,,,,,,,,,,,,,,,,,,,,,,,,,,,,,,,,,,,,,,,
09408175,"ST. GEORGE-WASHINGTON CANAL NR WASHINGTON, UT",37.11498228,-113.440785,,,,,,,,,,,,,,,,,,,,,,,,,,,,,,,,,,,,,,,,
09408195,"FORT PEARCE WASH NEAR ST. GEORGE, UT",37.00164939,-113.4688407,,,,,,,,,,,,,,,,,,,,,,,,,,,,,,,,,,,,,,,,
09408400,"SANTA CLARA RIVER NEAR PINE VALLEY, UT",37.38331325,-113.483288,,,,,,,,,,,,,,,,,,,,,,,,,,,,,,,,,,,,,,,,
09408500,"SANTA CLARA-PINTO DIVERSION NEAR PINTO, UT",37.4677569,-113.4732888,,,,,,,,,,,,,,,,,,,,,,,,,,,,,,,,,,,,,,,,
09409000,"SANTA CLARA RIVER NEAR CENTRAL, UTAH",37.39997885,-113.6174603,,,,,,,,,,,,,,,,,,,,,,,,,,,,,,,,,,,,,,,,
09409100,"SANTA CLARA RIVER ABV BAKER RES, NR CENTRAL, UT",37.38470108,-113.6319052,,,,,,,,,,,,,,,,,,,,,,,,,,,,,,,,,,,,,,,,
09409500,"MOODY WASH NEAR VEYO, UTAH",37.43331116,-113.742466,,,,,,,,,,,,,,,,,,,,,,,,,,,,,,,,,,,,,,,,
09409880,"SANTA CLARA RIVER AT GUNLOCK, UT",37.28192276,-113.7674656,,,,,,,,,,,,,,,,,,,,,,,,,,,,,,,,,,,,,,,,
09410000,"SANTA CLARA RIVER AB WINSOR DAM NR SANTA CLARA, UT",37.2180339,-113.7771877,,,,,,,,,,,,,,,,,,,,,,,,,,,,,,,,,,,,,,,,
09410100,"SANTA CLARA RIV BLW WINSOR DAM, NR SANTA CLARA, UT",37.19,-113.7680556,,,,,,,,,,,,,,,,,,,,,,,,,,,,,,,,,,,,,,,,
09410400,"SANTA CLARA RIVER NEAR SANTA CLARA, UTAH",37.13970168,-113.6927395,,,,,,,,,,,,,,,,,,,,,,,,,,,,,,,,,,,,,,,,
09413000,"SANTA CLARA RIVER AT ST. GEORGE, UT",37.07525867,-113.5930125,,,,,,,,,,,,,,,,,,,,,,,,,,,,,,,,,,,,,,,,
09413200,"VIRGIN RIVER NEAR BLOOMINGTON, UT",37.07,-113.5838889,,,,,,,,,,,,,,,,,,,,,,,,,,,,,,,,,,,,,,,,
09413500,"VIRGIN RIVER NEAR ST. GEORGE, UT",37.0144243,-113.6805163,,,,,,,,,,,,,,,,,,,,,,,,,,,,,,,,,,,,,,,,
09413900,"BEAVER DAM WASH NEAR ENTERPRISE, UT",37.46996127,-114.0466483,,,,,,,,,,,,,,,,,,,,,,,,,,,,,,,,,,,,,,,,
10010000,"GREAT SALT LAKE AT SALTAIR BOAT HARBOR, UT",40.73133329,-112.2135569,,,,,,,,,,,,,,,,,,,,,,,,,,,,,,,,,,,,,,,,
10010020,"GSL BREACH AT LAKESIDE, UT",41.2224135,-112.8499909,,,,,,,,,,,,,,,,,,,,,,,,,,,,,,,,,,,,,,,,
10010024,"GSL S. SIDE OF CAUSEWAY, 6 MILES E OF LAKESIDE, UT",41.2208722,-112.7572056,,,,,,,,,,,,,,,,,,,,,,,,,,,,,,,,,,,,,,,,
10010026,"GSL BREACH 6 MILES E OF LAKESIDE, UT; N TO S FLOW",41.2208611,-112.7663889,,,,,,,,,,,,,,,,,,,,,,,,,,,,,,,,,,,,,,,,
10010027,"GSL N. SIDE OF CAUSEWAY, 6 MILES E OF LAKESIDE, UT",41.22180278,-112.7806972,,,,,,,,,,,,,,,,,,,,,,,,,,,,,,,,,,,,,,,,
10010050,"GREAT SALT LAKE AT PROMONTORY POINT, UTAH",41.20271427,-112.426621,,,,,,,,,,,,,,,,,,,,,,,,,,,,,,,,,,,,,,,,
10010060,"BEAR R BAY OUTFLOW AT CAUSEWAY BRG NR WARREN, UT",41.23408367,-112.3371979,,,,,,,,,,,,,,,,,,,,,,,,,,,,,,,,,,,,,,,,
10010100,"GREAT SALT LAKE NEAR SALINE, UT",41.25521065,-112.496903,,,,,,,,,,,,,,,,,,,,,,,,,,,,,,,,,,,,,,,,
10010400,"EAST FK BEAR RIVER NR EVANSTON, WYOMING",40.8735579,-110.7840603,,,,,,,,,,,,,,,,,,,,,,,,,,,,,,,,,,,,,,,,
10010500,"HILLIARD-E FK CANAL NR ST LINE NR EVANSTON, WYO.",40.9166139,-110.8215619,,,,,,,,,,,,,,,,,,,,,,,,,,,,,,,,,,,,,,,,
10011200,"WEST FORK BEAR RIVER AT WHITNEY DAM, NR OAKLEY, UT",40.84161435,-110.927119,,,,,,,,,,,,,,,,,,,,,,,,,,,,,,,,,,,,,,,,
10011400,"WEST FK BEAR RIVER BL DEER CR NR EVANSTON, WYO",40.94439204,-110.8618412,,,,,,,,,,,,,,,,,,,,,,,,,,,,,,,,,,,,,,,,
10011500,BEAR RIVER NEAR UTAH-WYOMING STATE LINE,40.9652079,-110.853539,,,,,,,,,,,,,,,,,,,,,,,,,,,,,,,,,,,,,,,,
10012000,MILL CREEK AT UTAH-WYOMING STATE LINE,40.99161437,-110.8423969,,,,,,,,,,,,,,,,,,,,,,,,,,,,,,,,,,,,,,,,
10017000,"YELLOW CREEK NEAR EVANSTON, WYOMING",41.14411319,-111.0535167,,,,,,,,,,,,,,,,,,,,,,,,,,,,,,,,,,,,,,,,
10020500,"BEAR RIVER NEAR WOODRUFF, UTAH",41.52353387,-111.0479958,,,,,,,,,,,,,,,,,,,,,,,,,,,,,,,,,,,,,,,,
10020900,"WOODRUFF CREEK BELOW RESERVOIR NR WOODRUFF, UTAH",41.46799729,-111.3157543,,,,,,,,,,,,,,,,,,,,,,,,,,,,,,,,,,,,,,,,
10021000,"WOODRUFF CREEK NEAR WOODRUFF, UTAH",41.4818866,-111.2668638,,,,,,,,,,,,,,,,,,,,,,,,,,,,,,,,,,,,,,,,
10023000,"BIG CREEK NEAR RANDOLPH, UT",41.60994177,-111.2540876,,,,,,,,,,,,,,,,,,,,,,,,,,,,,,,,,,,,,,,,
10026500,"BEAR RIVER NEAR RANDOLPH, UT",41.79813889,-111.0706111,,,,,,,,,,,,,,,,,,,,,,,,,,,,,,,,,,,,,,,,
10055000,"BEAR LAKE AT STATE PARK MARINA NR GARDEN CITY, UT",41.96591667,-111.3981778,,,,,,,,,,,,,,,,,,,,,,,,,,,,,,,,,,,,,,,,
10095900,EAST BR CUB R CANAL N LEWISTON UT,41.9957594,-111.867449,,,,,,,,,,,,,,,,,,,,,,,,,,,,,,,,,,,,,,,,
10099000,"HIGH CREEK NEAR RICHMOND, UTAH",41.9777054,-111.7452222,,,,,,,,,,,,,,,,,,,,,,,,,,,,,,,,,,,,,,,,
10102200,CUB R NR RICHMOND UTAH,41.92631619,-111.8535584,,,,,,,,,,,,,,,,,,,,,,,,,,,,,,,,,,,,,,,,
10102250,"BEAR RIVER NEAR SMITHFIELD, UT",41.83992834,-111.8816133,,,,,,,,,,,,,,,,,,,,,,,,,,,,,,,,,,,,,,,,
10102300,"SUMMIT CREEK ABV DIVERSIONS NR SMITHFIELD, UTAH",41.86937369,-111.75911,,,,,,,,,,,,,,,,,,,,,,,,,,,,,,,,,,,,,,,,
10103010,"LOGAN,HYDE PK,& SMITHFIELD CNL.NR. SMITHFIELD,UT",41.84326239,-111.8138335,,,,,,,,,,,,,,,,,,,,,,,,,,,,,,,,,,,,,,,,
10104600,"SOUTH FORK LITTLE BEAR RIVER NEAR AVON, UTAH",41.500214,-111.8166074,,,,,,,,,,,,,,,,,,,,,,,,,,,,,,,,,,,,,,,,
10104700,LITTLE BEAR R BL DAVENPORT C NR AVON UT,41.51243597,-111.8118852,,,,,,,,,,,,,,,,,,,,,,,,,,,,,,,,,,,,,,,,
10104900,EAST FK LT BEAR RIV AB RESV NR AVON UTAH,41.51826988,-111.7143821,,,,,,,,,,,,,,,,,,,,,,,,,,,,,,,,,,,,,,,,
10105000,EAST FORK LITTLE BEAR R NR AVON UTAH,41.5166028,-111.7507725,,,,,,,,,,,,,,,,,,,,,,,,,,,,,,,,,,,,,,,,
10105900,"LITTLE BEAR RIVER AT PARADISE, UT",41.5754898,-111.8552203,,,,,,,,,,,,,,,,,,,,,,,,,,,,,,,,,,,,,,,,
10106000,"LITTLE BEAR RIVER NEAR PARADISE, UTAH",41.5902117,-111.8535537,,,,,,,,,,,,,,,,,,,,,,,,,,,,,,,,,,,,,,,,
10107000,HYRUM RESERVOIR NR HYRUM UTAH,41.6249329,-111.8757769,,,,,,,,,,,,,,,,,,,,,,,,,,,,,,,,,,,,,,,,
10107400,"WELLSVILLE-MENDON LOWER CANAL AT WELLSVILLE, UT",41.64854287,-111.9424456,,,,,,,,,,,,,,,,,,,,,,,,,,,,,,,,,,,,,,,,
10107500,"LITTLE BEAR RIVER NEAR HYRUM, UTAH",41.63326597,-111.8841105,,,,,,,,,,,,,,,,,,,,,,,,,,,,,,,,,,,,,,,,
10107600,LITTLE BEAR RIV AT WELLSVILLE UTAH,41.64743195,-111.9235562,,,,,,,,,,,,,,,,,,,,,,,,,,,,,,,,,,,,,,,,
10108000,UTAH POWER AND LIGHT TAILRACE NR LOGAN UTAH,41.74437546,-111.7841089,,,,,,,,,,,,,,,,,,,,,,,,,,,,,,,,,,,,,,,,
10108400,"CACHE HIGHLINE CANAL NEAR LOGAN, UTAH",41.743375,-111.762061,,,,,,,,,,,,,,,,,,,,,,,,,,,,,,,,,,,,,,,,
10108500,LOGAN HYD P AN SM CA N LOGAN UTAH,41.7457643,-111.7854979,,,,,,,,,,,,,,,,,,,,,,,,,,,,,,,,,,,,,,,,
10109000,"LOGAN RIVER ABOVE STATE DAM, NEAR LOGAN, UT",41.74355,-111.7839806,,,,,,,,,,,,,,,,,,,,,,,,,,,,,,,,,,,,,,,,
10109001,COM F LOGAN R AB ST D AND CACHE HL CAN NR LOGAN UT,41.74437546,-111.7843867,,,,,,,,,,,,,,,,,,,,,,,,,,,,,,,,,,,,,,,,
10111700,BLACKSMITH F B MILL C N HYRUM UT,41.5943815,-111.5674327,,,,,,,,,,,,,,,,,,,,,,,,,,,,,,,,,,,,,,,,
10112000,BLACKSMITH F A H RAN N HYRUM UTAH,41.61660266,-111.6174349,,,,,,,,,,,,,,,,,,,,,,,,,,,,,,,,,,,,,,,,
10113500,"BLACKSMITH FORK AB UP and L CO.'S DAM NR HYRUM, UT",41.62400556,-111.7361639,,,,,,,,,,,,,,,,,,,,,,,,,,,,,,,,,,,,,,,,
10115200,"LOGAN RIVER BLW BLACKSMITH FORK NR LOGAN, UTAH",41.72076375,-111.8863337,,,,,,,,,,,,,,,,,,,,,,,,,,,,,,,,,,,,,,,,
10116500,"CUTLER RESERVOIR NEAR COLLINSTON, UT",41.8368712,-112.048285,,,,,,,,,,,,,,,,,,,,,,,,,,,,,,,,,,,,,,,,
10117000,"HAMMOND (EAST SIDE) CANAL NEAR COLLINSTON, UT",41.830746,-112.0574747,,,,,,,,,,,,,,,,,,,,,,,,,,,,,,,,,,,,,,,,
10117500,"WEST SIDE CANAL NEAR COLLINSTON, UT",41.8318571,-112.0608081,,,,,,,,,,,,,,,,,,,,,,,,,,,,,,,,,,,,,,,,
10117510,WEST CANAL ABV SALT CREEK DIV NR TREMONTON UT,41.71409458,-112.2274541,,,,,,,,,,,,,,,,,,,,,,,,,,,,,,,,,,,,,,,,
10117530,"WEST CANAL BLW SALT CREEK DIV NR TREMONTON, UT",41.71298348,-112.228843,,,,,,,,,,,,,,,,,,,,,,,,,,,,,,,,,,,,,,,,
10118000,"BEAR RIVER NEAR COLLINSTON, UT",41.8340793,-112.0552524,,,,,,,,,,,,,,,,,,,,,,,,,,,,,,,,,,,,,,,,
