Site Code,Site Name,Latitude,Longitude,COLLECTION_SYSTEM,collection_sys_description,MasterStationID,MasterStationName,CollectionStationName,RETRIES,SEQ_NO,COMMENTS,LAT,LON,STATION_TYPE,COMMON_DESC,DIVERTING_WORKS,MEASURING_DEVICE,RECORD_RATING,SYSTEM_NAME,UNITS_ID,OWNER_NAME,CAPTURE_SEQ_NO,ANALOG_CHANNEL,LOW_FLOW,HIGH_FLOW,DEVICE_TYPE,OWNER_PHONE,REALTIME_INCLUDE,CORRECTED_DATA,STATUS,SYSTEM_GROUP,SYSTEM_SUBGROUP,ADDRESS_ID,DataEntryMethod,DataLogger,DatasetType,SeriesVerifiedBy,SeriesVerifiedDate,SiteState,SiteType,SiteVerifiedBy,SiteVerifiedDate,Telemetry
09163675,"COTTONWOOD WASH AT I-70, NEAR CISCO, UTAH",39.08165184,-109.2176153,,,,,,,,,,,,,,,,,,,,,,,,,,,,,,,,,,,,,,,,
09180000,"DOLORES RIVER NEAR CISCO, UT",38.79720805,-109.1951142,,,,,,,,,,,,,,,,,,,,,,,,,,,,,,,,,,,,,,,,
09180500,"COLORADO RIVER NEAR CISCO, UT",38.81054095,-109.2934493,,,,,,,,,,,,,,,,,,,,,,,,,,,,,,,,,,,,,,,,
09180920,"ONION CREEK ABOVE ONION C BRIDGE NR MOAB, UT",38.69693046,-109.2551154,,,,,,,,,,,,,,,,,,,,,,,,,,,,,,,,,,,,,,,,
09180970,"ONION CREEK BELOW ONION CRK BRIDGE NR MOAB, UT",38.70637365,-109.3151161,,,,,,,,,,,,,,,,,,,,,,,,,,,,,,,,,,,,,,,,
09181000,"ONION CREEK NEAR MOAB, UTAH",38.72498404,-109.3451166,,,,,,,,,,,,,,,,,,,,,,,,,,,,,,,,,,,,,,,,
09181500,"PROFESSOR CREEK NEAR MOAB, UT",38.72915,-109.3756725,,,,,,,,,,,,,,,,,,,,,,,,,,,,,,,,,,,,,,,,
09182000,"CASTLE CREEK ABOVE DIVERSIONS, NEAR MOAB, UTAH",38.5927639,-109.2656708,,,,,,,,,,,,,,,,,,,,,,,,,,,,,,,,,,,,,,,,
09182200,"CASTLE CREEK BELOW CASTLETON NEAR MOAB, UT",38.6124849,-109.332338,,,,,,,,,,,,,,,,,,,,,,,,,,,,,,,,,,,,,,,,
09182400,"CASTLE CREEK BELOW CASTLE VALLEY NEAR MOAB, UT",38.673859,-109.4501395,,,,,,,,,,,,,,,,,,,,,,,,,,,,,,,,,,,,,,,,
09182500,"CASTLE CREEK NEAR MOAB, UTAH",38.67914895,-109.4492841,,,,,,,,,,,,,,,,,,,,,,,,,,,,,,,,,,,,,,,,
09182900,"COURTHOUSE WASH AT ARCHES HWY CROSS NR MOAB, UT",38.64859187,-109.5992853,,,,,,,,,,,,,,,,,,,,,,,,,,,,,,,,,,,,,,,,
09183000,"COURTHOUSE WASH NEAR MOAB, UTAH",38.61275926,-109.5798402,,,,,,,,,,,,,,,,,,,,,,,,,,,,,,,,,,,,,,,,
09183500,"MILL CREEK AT SHELEY TUNNEL, NEAR MOAB, UT",38.4819972,-109.405025,,,,,,,,,,,,,,,,,,,,,,,,,,,,,,,,,,,,,,,,
09183600,"MILL CREEK BELOW SHELEY TUNNEL, NEAR MOAB, UT",38.48571796,-109.4111044,,,,,,,,,,,,,,,,,,,,,,,,,,,,,,,,,,,,,,,,
09183800,"NORTH FORK MILL CREEK NEAR MOAB, UTAH",38.56599444,-109.477175,,,,,,,,,,,,,,,,,,,,,,,,,,,,,,,,,,,,,,,,
09184000,"MILL CREEK NEAR MOAB, UT",38.56220477,-109.5140057,,,,,,,,,,,,,,,,,,,,,,,,,,,,,,,,,,,,,,,,
09184500,"PACK CREEK AT M4 RANCH, NR MOAB, UTAH",38.43609688,-109.3548368,,,,,,,,,,,,,,,,,,,,,,,,,,,,,,,,,,,,,,,,
09184600,"PACK CREEK AT PACK CREEK ROAD BRIDGE NEAR MOAB, UT",38.44580556,-109.38525,,,,,,,,,,,,,,,,,,,,,,,,,,,,,,,,,,,,,,,,
09185000,"PACK CREEK NEAR MOAB, UTAH",38.5402606,-109.500672,,,,,,,,,,,,,,,,,,,,,,,,,,,,,,,,,,,,,,,,
09185100,"MILL CREEK BLW PACK CREEK NR MOUTH AT MOAB, UT",38.5732861,-109.5672083,,,,,,,,,,,,,,,,,,,,,,,,,,,,,,,,,,,,,,,,
09185500,"HATCH WASH NEAR LA SAL, UTAH",38.24332,-109.4401142,,,,,,,,,,,,,,,,,,,,,,,,,,,,,,,,,,,,,,,,
09185600,"COLORADO RIVER AT POTASH, UT",38.5047222,-109.6583333,,,,,,,,,,,,,,,,,,,,,,,,,,,,,,,,,,,,,,,,
09185800,"INDIAN CREEK TUNNEL NEAR MONTICELLO, UTAH",37.8411046,-109.5054004,,,,,,,,,,,,,,,,,,,,,,,,,,,,,,,,,,,,,,,,
09186000,"INDIAN CREEK NEAR MONTICELLO, UTAH",37.84443774,-109.518734,,,,,,,,,,,,,,,,,,,,,,,,,,,,,,,,,,,,,,,,
09186500,"INDIAN C AB COTTONWOOD CREEK, NR MONTICELLO, UT",37.9722137,-109.5192888,,,,,,,,,,,,,,,,,,,,,,,,,,,,,,,,,,,,,,,,
09187000,"COTTONWOOD CREEK NEAR MONTICELLO, UTAH",38.06248946,-109.5742877,,,,,,,,,,,,,,,,,,,,,,,,,,,,,,,,,,,,,,,,
09187500,"INDIAN CREEK ABV HARTS DRAW, NR MONTICELLO, UT",38.1516546,-109.6256753,,,,,,,,,,,,,,,,,,,,,,,,,,,,,,,,,,,,,,,,
09187550,"INDIAN CREEK BLW BOGUS POCKET, NR MONTICELLO, UT",38.1516546,-109.6256753,,,,,,,,,,,,,,,,,,,,,,,,,,,,,,,,,,,,,,,,
09217900,"BLACKS FORK NEAR ROBERTSON, WY",40.95902778,-110.5797222,,,,,,,,,,,,,,,,,,,,,,,,,,,,,,,,,,,,,,,,
09219500,"E Fk Smiths Fk at China Meadows, nr Robertson, WY",40.9333333,-110.4002778,,,,,,,,,,,,,,,,,,,,,,,,,,,,,,,,,,,,,,,,
09225500,"GREEN RIVER NEAR LINWOOD, UTAH",40.9666262,-109.5784759,,,,,,,,,,,,,,,,,,,,,,,,,,,,,,,,,,,,,,,,
09226500,"MIDDLE FORK BEAVER CREEK NEAR LONETREE, WYO.",40.9443932,-110.1793209,,,,,,,,,,,,,,,,,,,,,,,,,,,,,,,,,,,,,,,,
09227000,"EF BEAVER CREEK NEAR LONETREE, WYOMING",40.9443936,-110.1618207,,,,,,,,,,,,,,,,,,,,,,,,,,,,,,,,,,,,,,,,
09227500,"WEST FORK BEAVER CREEK NEAR LONETREE, WYOMING",40.94717019,-110.2173767,,,,,,,,,,,,,,,,,,,,,,,,,,,,,,,,,,,,,,,,
09228500,"BURNT FORK NEAR BURNTFORK, WY",40.94632437,-110.0662927,,,,,,,,,,,,,,,,,,,,,,,,,,,,,,,,,,,,,,,,
09230300,"BIRCH SPRING DRAW AT FGNRA BOUNDARY NR MANILA, UT",40.99027778,-109.6545278,,,,,,,,,,,,,,,,,,,,,,,,,,,,,,,,,,,,,,,,
09231000,"SHEEP CREEK UPPER CANAL NEAR MANILA, UTAH",40.8991204,-109.9348746,,,,,,,,,,,,,,,,,,,,,,,,,,,,,,,,,,,,,,,,
09231200,"CARTER CREEK CANAL NEAR MANILA, UTAH",40.88550978,-109.9059854,,,,,,,,,,,,,,,,,,,,,,,,,,,,,,,,,,,,,,,,
09231500,"SHEEP CREEK LOWER CANAL NEAR MANILA, UTAH",40.89023219,-109.8984853,,,,,,,,,,,,,,,,,,,,,,,,,,,,,,,,,,,,,,,,
09232000,"SHEEP CREEK NEAR MANILA, UTAH",40.88606539,-109.9034853,,,,,,,,,,,,,,,,,,,,,,,,,,,,,,,,,,,,,,,,
09232500,"SHEEP CREEK AT MOUTH NEAR MANILA, UTAH",40.9332919,-109.6562573,,,,,,,,,,,,,,,,,,,,,,,,,,,,,,,,,,,,,,,,
09233000,"CARTER CREEK NEAR MANILA, UTAH",40.83884416,-109.8312619,,,,,,,,,,,,,,,,,,,,,,,,,,,,,,,,,,,,,,,,
09233500,"RED LAKE OUTLET NR MANILA, UT",40.8457892,-109.8026504,,,,,,,,,,,,,,,,,,,,,,,,,,,,,,,,,,,,,,,,
09234000,"CARTER CREEK AT MOUTH NEAR MANILA, UTAH",40.8930143,-109.5923652,,,,,,,,,,,,,,,,,,,,,,,,,,,,,,,,,,,,,,,,
09234500,"GREEN RIVER NEAR GREENDALE, UT",40.90829296,-109.422914,,,,,,,,,,,,,,,,,,,,,,,,,,,,,,,,,,,,,,,,
09234700,"RED CREEK NEAR DUTCH JOHN, UTAH",40.9696816,-109.237352,,,,,,,,,,,,,,,,,,,,,,,,,,,,,,,,,,,,,,,,
09235000,"GREEN RIVER AT BRIDGEPORT, UTAH",40.8621822,-109.1395701,,,,,,,,,,,,,,,,,,,,,,,,,,,,,,,,,,,,,,,,
09235100,"CROUSE CREEK NEAR VERNAL, UT",40.7952383,-109.0912348,,,,,,,,,,,,,,,,,,,,,,,,,,,,,,,,,,,,,,,,
09235600,"POT CREEK ABOVE DIVERSIONS, NEAR VERNAL, UTAH",40.768015,-109.3190219,,,,,,,,,,,,,,,,,,,,,,,,,,,,,,,,,,,,,,,,
09235800,"POT CREEK NEAR VERNAL, UTAH",40.67357295,-109.0515105,,,,,,,,,,,,,,,,,,,,,,,,,,,,,,,,,,,,,,,,
09261000,"GREEN RIVER NEAR JENSEN, UT",40.4093915,-109.2354283,,,,,,,,,,,,,,,,,,,,,,,,,,,,,,,,,,,,,,,,
09261500,"BIG BRUSH CREEK (AB CAVE) NR VERNAL, UTAH",40.7041243,-109.5965309,,,,,,,,,,,,,,,,,,,,,,,,,,,,,,,,,,,,,,,,
09261700,"BIG BRUSH CRK ABV RED FLEET RES, NR VERNAL, UT",40.5888323,-109.4654372,,,,,,,,,,,,,,,,,,,,,,,,,,,,,,,,,,,,,,,,
09262000,"BIG BRUSH CREEK NEAR VERNAL,UTAH",40.58162648,-109.4348572,,,,,,,,,,,,,,,,,,,,,,,,,,,,,,,,,,,,,,,,
09262500,LT BRUSH CR BL E PK RES NR VERNAL UT,40.75829135,-109.534029,,,,,,,,,,,,,,,,,,,,,,,,,,,,,,,,,,,,,,,,
09263000,"LITTLE BRUSH CREEK NR VERNAL, UT",40.7160695,-109.5056942,,,,,,,,,,,,,,,,,,,,,,,,,,,,,,,,,,,,,,,,
09263500,"BRUSH CREEK NEAR JENSEN, UTAH",40.4085734,-109.3409634,,,,,,,,,,,,,,,,,,,,,,,,,,,,,,,,,,,,,,,,
09264000,"ASHLEY C BELOW TROUT C NR VERNAL, UTAH",40.73329,-109.6784789,,,,,,,,,,,,,,,,,,,,,,,,,,,,,,,,,,,,,,,,
09264500,"SOUTH FORK ASHLEY C NR VERNAL, UTAH",40.7332898,-109.7034799,,,,,,,,,,,,,,,,,,,,,,,,,,,,,,,,,,,,,,,,
09265000,"OAKS PARK CANAL NEAR VERNAL, UTAH",40.74329049,-109.6223657,,,,,,,,,,,,,,,,,,,,,,,,,,,,,,,,,,,,,,,,
09265300,"ASHLEY CREEK ABOVE RED PINE CREEK NR VERNAL, UT",40.6796794,-109.6609775,,,,,,,,,,,,,,,,,,,,,,,,,,,,,,,,,,,,,,,,
09265500,ASHLEY CR ABV SP NR VERNAL UT,40.58884697,-109.6229194,,,,,,,,,,,,,,,,,,,,,,,,,,,,,,,,,,,,,,,,
09266000,ASHLEY CR SPRING NR VERNAL UT,40.5860692,-109.6229194,,,,,,,,,,,,,,,,,,,,,,,,,,,,,,,,,,,,,,,,
09266500,"ASHLEY CREEK NEAR VERNAL, UT",40.5774426,-109.6221085,,,,,,,,,,,,,,,,,,,,,,,,,,,,,,,,,,,,,,,,
09267100,"ASHLEY CREEK ABOVE DRY FORK, NR VERNAL, UTAH",40.53773628,-109.6098627,,,,,,,,,,,,,,,,,,,,,,,,,,,,,,,,,,,,,,,,
09267500,"MOSBY CANAL NEAR LAPOINT, UT",40.6082881,-109.8840393,,,,,,,,,,,,,,,,,,,,,,,,,,,,,,,,,,,,,,,,
09268000,"DRY FORK ABOVE SINKS, NEAR DRY FORK, UTAH",40.6263445,-109.8201488,,,,,,,,,,,,,,,,,,,,,,,,,,,,,,,,,,,,,,,,
09268500,"NORTH FORK OF DRY FORK NEAR DRY FORK, UTAH",40.6427334,-109.810982,,,,,,,,,,,,,,,,,,,,,,,,,,,,,,,,,,,,,,,,
09268900,"BROWNIE CANYON ABOVE SINKS, NR DRY FORK, UTAH",40.65940095,-109.7509807,,,,,,,,,,,,,,,,,,,,,,,,,,,,,,,,,,,,,,,,
09269000,"EAST FORK OF DRY FORK NEAR DRY FORK, UTAH",40.64995639,-109.7618142,,,,,,,,,,,,,,,,,,,,,,,,,,,,,,,,,,,,,,,,
09269500,EAST FORK OF DRY FORK AT MOUTH NR DRY FORK,40.63328979,-109.7645918,,,,,,,,,,,,,,,,,,,,,,,,,,,,,,,,,,,,,,,,
09270000,"DRY FORK BELOW SPRINGS NEAR DRY FORK, UTAH",40.56940199,-109.6976441,,,,,,,,,,,,,,,,,,,,,,,,,,,,,,,,,,,,,,,,
09270500,"DRY FORK AT MOUTH NEAR DRY FORK, UTAH",40.5263475,-109.6056958,,,,,,,,,,,,,,,,,,,,,,,,,,,,,,,,,,,,,,,,
09271000,"ASHLEY CR NR REMEMBER THE MAINE PARK NR VERNAL, UT",40.5141111,-109.5943694,,,,,,,,,,,,,,,,,,,,,,,,,,,,,,,,,,,,,,,,
09271070,"HIGHLINE CANAL BL MANTLE GULCH NR JENSEN, UTAH",40.36690605,-109.5034685,,,,,,,,,,,,,,,,,,,,,,,,,,,,,,,,,,,,,,,,
09271300,"STEINAKER RESERVOIR NEAR VERNAL, UTAH",40.50690378,-109.5340263,,,,,,,,,,,,,,,,,,,,,,,,,,,,,,,,,,,,,,,,
09271400,"ASHLEY CREEK NEAR NAPLES, UT",40.43357206,-109.4662456,,,,,,,,,,,,,,,,,,,,,,,,,,,,,,,,,,,,,,,,
09271425,"ASHLEY CRK ABV RIV IRR PIPELINE NR NAPLES, UT",40.40657267,-109.4351054,,,,,,,,,,,,,,,,,,,,,,,,,,,,,,,,,,,,,,,,
09271450,"ASHLEY CREEK BL SADLIER DRAW, NEAR NAPLES, UT",40.39801727,-109.4295774,,,,,,,,,,,,,,,,,,,,,,,,,,,,,,,,,,,,,,,,
09271470,"RIVER IRRIGATION COMPANY CANAL NEAR JENSEN, UTAH",40.37857327,-109.4017985,,,,,,,,,,,,,,,,,,,,,,,,,,,,,,,,,,,,,,,,
09271500,"ASHLEY CREEK NEAR JENSEN, UTAH",40.37468439,-109.4081875,,,,,,,,,,,,,,,,,,,,,,,,,,,,,,,,,,,,,,,,
09271550,"ASHLEY CREEK BEL UNION CANAL DIV NR JENSEN, UT",40.3580023,-109.3876546,,,,,,,,,,,,,,,,,,,,,,,,,,,,,,,,,,,,,,,,
09271600,"STEWART LAKE OUTFLOW NEAR JENSEN, UT",40.3460739,-109.3631856,,,,,,,,,,,,,,,,,,,,,,,,,,,,,,,,,,,,,,,,
09272400,"GREEN RIVER AT OURAY, UTAH",40.0847972,-109.6758361,,,,,,,,,,,,,,,,,,,,,,,,,,,,,,,,,,,,,,,,
09272500,"DUCHESNE TUNNEL NEAR KAMAS, UTAH",40.59244518,-111.0026689,,,,,,,,,,,,,,,,,,,,,,,,,,,,,,,,,,,,,,,,
09273000,"DUCHESNE R AT PROVO R TRAIL NR HANNA, UTAH",40.62494547,-110.8896127,,,,,,,,,,,,,,,,,,,,,,,,,,,,,,,,,,,,,,,,
09273200,DUCHESNE R BL LT DEER C NR HANNA UT,40.62216766,-110.8923904,,,,,,,,,,,,,,,,,,,,,,,,,,,,,,,,,,,,,,,,
09273500,"HADES CREEK NEAR HANNA, UTAH",40.53605548,-110.8673873,,,,,,,,,,,,,,,,,,,,,,,,,,,,,,,,,,,,,,,,
09274000,"DUCHESNE RIVER (N.FORK) NEAR HANNA, UTAH",40.53327767,-110.8673872,,,,,,,,,,,,,,,,,,,,,,,,,,,,,,,,,,,,,,,,
09274900,"W.F. DUCHESNE RIV BEL VAT DIVERSION NR HANNA, UT",40.450223,-111.0043319,,,,,,,,,,,,,,,,,,,,,,,,,,,,,,,,,,,,,,,,
09275000,"W F DUCHESNE RIVER BL DRY HOLLOW NR HANNA, UT",40.44855637,-110.9757204,,,,,,,,,,,,,,,,,,,,,,,,,,,,,,,,,,,,,,,,
09275500,"WEST FORK DUCHESNE RIVER NEAR HANNA, UT",40.45022335,-110.8843304,,,,,,,,,,,,,,,,,,,,,,,,,,,,,,,,,,,,,,,,
09276000,"WOLF CREEK ABOVE RHOADES CANYON NEAR HANNA, UT",40.4710558,-110.9187754,,,,,,,,,,,,,,,,,,,,,,,,,,,,,,,,,,,,,,,,
09276500,WOLF CREEK NR HANNA UT,40.45272328,-110.8826638,,,,,,,,,,,,,,,,,,,,,,,,,,,,,,,,,,,,,,,,
09276600,"W.F. DUCHESNE RIVER ABV NORTH FORK, NR HANNA, UT",40.46160295,-110.836866,,,,,,,,,,,,,,,,,,,,,,,,,,,,,,,,,,,,,,,,
09277000,"DUCHESNE R (@ 'THE POINT'), @ HANNA, UTAH",40.41522494,-110.7826621,,,,,,,,,,,,,,,,,,,,,,,,,,,,,,,,,,,,,,,,
09277500,"DUCHESNE RIVER NEAR TABIONA, UT",40.2997472,-110.6042556,,,,,,,,,,,,,,,,,,,,,,,,,,,,,,,,,,,,,,,,
09277501,COM FL DUCHESNE R & DUCHESNE TUN NR TABIONA,40.30023027,-110.602381,,,,,,,,,,,,,,,,,,,,,,,,,,,,,,,,,,,,,,,,
09277800,"ROCK CREEK ABOVE SOUTH FORK, NEAR HANNA, UT",40.55744514,-110.6979414,,,,,,,,,,,,,,,,,,,,,,,,,,,,,,,,,,,,,,,,
09278000,"SOUTH FORK ROCK CREEK NEAR HANNA,UTAH",40.54827849,-110.69433,,,,,,,,,,,,,,,,,,,,,,,,,,,,,,,,,,,,,,,,
09278500,"ROCK CREEK NEAR HANNA, UTAH",40.545501,-110.656274,,,,,,,,,,,,,,,,,,,,,,,,,,,,,,,,,,,,,,,,
09278700,ROCK CR BL MINERS GULCH NR HANNA UTAH,40.53244575,-110.6234957,,,,,,,,,,,,,,,,,,,,,,,,,,,,,,,,,,,,,,,,
09279000,"ROCK CREEK NEAR MOUNTAIN HOME, UT",40.4931111,-110.5772222,,,,,,,,,,,,,,,,,,,,,,,,,,,,,,,,,,,,,,,,
09279100,"ROCK CREEK NEAR TALMAGE, UT",40.31106428,-110.4940467,,,,,,,,,,,,,,,,,,,,,,,,,,,,,,,,,,,,,,,,
09279150,"DUCHESNE RIV ABV KNIGHT DIVERSION, NR DUCHESNE, UT",40.27051046,-110.4426567,,,,,,,,,,,,,,,,,,,,,,,,,,,,,,,,,,,,,,,,
09279500,"DUCHESNE RIVER AT DUCHESNE, UTAH",40.16412475,-110.3934884,,,,,,,,,,,,,,,,,,,,,,,,,,,,,,,,,,,,,,,,
09279501,COM FL DUCHESNE R AT DUCHESNE & DUCHESNE TUNNEL,40.16412475,-110.3934884,,,,,,,,,,,,,,,,,,,,,,,,,,,,,,,,,,,,,,,,
09280000,"STRAWBERRY R AND WILLOW C DITCHES NR HEBER, UT",40.3332882,-111.2340606,,,,,,,,,,,,,,,,,,,,,,,,,,,,,,,,,,,,,,,,
09280400,HOBBLE CREEK AT DANIELS SUMMIT NEAR WALLSBURG UT,40.29828906,-111.2651733,,,,,,,,,,,,,,,,,,,,,,,,,,,,,,,,,,,,,,,,
09280500,"UPPER HOBBLE CREEK DITCH NEAR HEBER, UTAH",40.29995559,-111.2507279,,,,,,,,,,,,,,,,,,,,,,,,,,,,,,,,,,,,,,,,
09281000,"LOWER HOBBLE CREEK DITCH NEAR HEBER, UTAH",40.29995559,-111.2507279,,,,,,,,,,,,,,,,,,,,,,,,,,,,,,,,,,,,,,,,
09281500,"HOBBLE CREEK DITCH NEAR HEBER, UTAH",40.29995559,-111.2507279,,,,,,,,,,,,,,,,,,,,,,,,,,,,,,,,,,,,,,,,
09282000,"STRAWBERRY TUNNEL AT WEST PORTAL, NR THISTLE",40.1610673,-111.2451727,,,,,,,,,,,,,,,,,,,,,,,,,,,,,,,,,,,,,,,,
09282500,"STRAWBERRY RESERVOIR NR SOLDIER SPRINGS, UTAH",40.16939998,-111.1798927,,,,,,,,,,,,,,,,,,,,,,,,,,,,,,,,,,,,,,,,
09285000,"STRAWBERRY RIVER NEAR SOLDIER SPRINGS, UT",40.13328794,-111.024887,,,,,,,,,,,,,,,,,,,,,,,,,,,,,,,,,,,,,,,,
09285500,WILLOW CR NR SOLDIER SPRINGS UT,40.1180103,-111.010442,,,,,,,,,,,,,,,,,,,,,,,,,,,,,,,,,,,,,,,,
09285700,"STRAWBERRY RIVER ABOVE RED C NR FRUITLAND, UT",40.11690036,-110.8082145,,,,,,,,,,,,,,,,,,,,,,,,,,,,,,,,,,,,,,,,
09285900,"STRAWBERRY RIVER AT PINNACLES NEAR FRUITLAND, UT",40.1271783,-110.7418242,,,,,,,,,,,,,,,,,,,,,,,,,,,,,,,,,,,,,,,,
09286100,"RED CREEK ABOVE RESERVOIR, NEAR FRUITLAND, UT",40.32994978,-110.8626625,,,,,,,,,,,,,,,,,,,,,,,,,,,,,,,,,,,,,,,,
09286500,"RED CREEK NR FRUITLAND, UTAH",40.2013428,-110.7840484,,,,,,,,,,,,,,,,,,,,,,,,,,,,,,,,,,,,,,,,
09286700,"CURRANT CRK BLW CURRANT CRK DAM, NR FRUITLAND, UT",40.33078385,-111.0496107,,,,,,,,,,,,,,,,,,,,,,,,,,,,,,,,,,,,,,,,
09287000,"CURRANT C BL RED LEDGE HOLLOW NR FRUITLAND, UT",40.3241173,-111.0459995,,,,,,,,,,,,,,,,,,,,,,,,,,,,,,,,,,,,,,,,
09287500,"WATER HOLLOW NR FRUITLAND, UTAH",40.2416191,-110.9807197,,,,,,,,,,,,,,,,,,,,,,,,,,,,,,,,,,,,,,,,
09288000,"CURRANT CREEK NEAR FRUITLAND, UT",40.20023128,-110.9076623,,,,,,,,,,,,,,,,,,,,,,,,,,,,,,,,,,,,,,,,
09288100,"RED CREEK BELOW CURRANT CREEK, NEAR FRUITLAND, U",40.14634437,-110.7532135,,,,,,,,,,,,,,,,,,,,,,,,,,,,,,,,,,,,,,,,
09288150,"W F AVINTAQUIN CREEK NR FRUITLAND, UTAH",39.9930144,-110.8148798,,,,,,,,,,,,,,,,,,,,,,,,,,,,,,,,,,,,,,,,
09288180,"STRAWBERRY RIVER NEAR DUCHESNE, UT",40.1546793,-110.5548785,,,,,,,,,,,,,,,,,,,,,,,,,,,,,,,,,,,,,,,,
09288395,"STARVATON RESERVOIR NEAR DUCHESNE, UT",40.19079039,-110.4432113,,,,,,,,,,,,,,,,,,,,,,,,,,,,,,,,,,,,,,,,
09288400,"STRAWBERRY R BLW STARVATION RES NR DUCHESNE, UT",40.17384647,-110.4295999,,,,,,,,,,,,,,,,,,,,,,,,,,,,,,,,,,,,,,,,
09288500,"STRAWBERRY RIVER AT DUCHESNE, UTAH",40.16106914,-110.4118219,,,,,,,,,,,,,,,,,,,,,,,,,,,,,,,,,,,,,,,,
09288900,"SOWERS CREEK NEAR DUCHESNE, UTAH",39.9894064,-110.4598762,,,,,,,,,,,,,,,,,,,,,,,,,,,,,,,,,,,,,,,,
09289000,"ANTELOPE CREEK NEAR MYTON, UTAH",40.13607105,-110.209042,,,,,,,,,,,,,,,,,,,,,,,,,,,,,,,,,,,,,,,,
09289500,"LAKE FORK RIVER AB MOON LAKE, NR MOUNTAIN HOME, UT",40.6024722,-110.5205,,,,,,,,,,,,,,,,,,,,,,,,,,,,,,,,,,,,,,,,
09290000,"BROWN DUCK CREEK NEAR MOUNTAIN HOME, UTAH",40.5749462,-110.5173839,,,,,,,,,,,,,,,,,,,,,,,,,,,,,,,,,,,,,,,,
09290500,"MOON LAKE RESERVOIR NEAR MOUNTAIN HOME, UT",40.561891,-110.4898835,,,,,,,,,,,,,,,,,,,,,,,,,,,,,,,,,,,,,,,,
09291000,"LAKE FORK RIVER BL MOON LAKE NR MOUNTAIN HOME, UT",40.55633555,-110.4846056,,,,,,,,,,,,,,,,,,,,,,,,,,,,,,,,,,,,,,,,
09291200,"LAKE FORK R BL TASKEECH DAMSITE NR MT HOME, UT",40.501337,-110.4054383,,,,,,,,,,,,,,,,,,,,,,,,,,,,,,,,,,,,,,,,
09291500,"YELLOWSTONE CR. BELOW SWIFT CR.,NR ALTONAH,UT.",40.59716926,-110.3479376,,,,,,,,,,,,,,,,,,,,,,,,,,,,,,,,,,,,,,,,
09292000,"YELLOWSTONE R @ BRIDGE CMPGRND NR ALTONAH, UT",40.5463369,-110.333771,,,,,,,,,,,,,,,,,,,,,,,,,,,,,,,,,,,,,,,,
09292500,"YELLOWSTONE RIVER NEAR ALTONAH, UT",40.51189299,-110.3415491,,,,,,,,,,,,,,,,,,,,,,,,,,,,,,,,,,,,,,,,
09293000,"YELLOWSTONE RIVER @ MOUTH NR ALTONAH, UT",40.4441169,-110.3640482,,,,,,,,,,,,,,,,,,,,,,,,,,,,,,,,,,,,,,,,
09293500,"LAKE FORK RIVER NR ALTONAH, UT.",40.4368949,-110.3643258,,,,,,,,,,,,,,,,,,,,,,,,,,,,,,,,,,,,,,,,
09293600,"LAKE FORK RIVER NEAR ALTAMONT, UTAH",40.35773117,-110.3134906,,,,,,,,,,,,,,,,,,,,,,,,,,,,,,,,,,,,,,,,
09293700,"PIGEON WATER CREEK NEAR ALTAMONT, UTAH",40.31051058,-110.294045,,,,,,,,,,,,,,,,,,,,,,,,,,,,,,,,,,,,,,,,
09294000,"LAKE FORK RIVER NEAR UPALCO, UTAH",40.2582906,-110.2223761,,,,,,,,,,,,,,,,,,,,,,,,,,,,,,,,,,,,,,,,
09294500,"LAKE FORK RIVER NEAR MYTON, UT",40.20883299,-110.1171195,,,,,,,,,,,,,,,,,,,,,,,,,,,,,,,,,,,,,,,,
09295000,"DUCHESNE RIVER AT MYTON, UT",40.20023757,-110.0637613,,,,,,,,,,,,,,,,,,,,,,,,,,,,,,,,,,,,,,,,
09295100,"DUCHESNE RIV ABV UINTA RIV, NR RANDLETT, UT",40.2066278,-109.8598673,,,,,,,,,,,,,,,,,,,,,,,,,,,,,,,,,,,,,,,,
09295500,UINTA R BL GILBERT C N NEOLA UTAH,40.78605648,-110.2396005,,,,,,,,,,,,,,,,,,,,,,,,,,,,,,,,,,,,,,,,
09296000,UINTA R ABOVE CLOVER C NEAR NEOLA UTAH,40.63050466,-110.1590454,,,,,,,,,,,,,,,,,,,,,,,,,,,,,,,,,,,,,,,,
09296500,"CLOVER CREEK NEAR NEOLA, UTAH",40.6249498,-110.1312672,,,,,,,,,,,,,,,,,,,,,,,,,,,,,,,,,,,,,,,,
09296800,"UINTA R BLW POWERPLANT DIVERSION, NR NEOLA, UT",40.5913396,-110.1143226,,,,,,,,,,,,,,,,,,,,,,,,,,,,,,,,,,,,,,,,
09297000,"UINTA RIVER NEAR NEOLA, UTAH",40.5355082,-110.0634884,,,,,,,,,,,,,,,,,,,,,,,,,,,,,,,,,,,,,,,,
09297500,"UINTA RIVER NEAR WHITEROCKS, UTAH",40.5207866,-110.0409878,,,,,,,,,,,,,,,,,,,,,,,,,,,,,,,,,,,,,,,,
09297600,"W CHANNEL UINTAH R BL DIV WKS NR WHITEROCKS, UT",40.46078907,-109.9507067,,,,,,,,,,,,,,,,,,,,,,,,,,,,,,,,,,,,,,,,
09297700,"E CHANNEL UINTAH R BL DIV WKS NR WHITEROCKS, UT",40.4718999,-109.955707,,,,,,,,,,,,,,,,,,,,,,,,,,,,,,,,,,,,,,,,
09297800,"E CHANL UINTA R AT CO RD BRIG NR WHITEROCKS, UT",40.454956,-109.9365395,,,,,,,,,,,,,,,,,,,,,,,,,,,,,,,,,,,,,,,,
09297900,"E CHANL UINTA RIVER @ LAPOINT RD NR LAPOINT, UTAH",40.40356876,-109.8759812,,,,,,,,,,,,,,,,,,,,,,,,,,,,,,,,,,,,,,,,
09298000,"FARM CREEK NEAR WHITEROCKS, UTAH",40.56745407,-109.9615413,,,,,,,,,,,,,,,,,,,,,,,,,,,,,,,,,,,,,,,,
09298500,WHITEROCKS R AB PARADISE C N WHITEROCKS UTAH,40.6360643,-109.967375,,,,,,,,,,,,,,,,,,,,,,,,,,,,,,,,,,,,,,,,
09299000,"PARADISE CREEK NEAR WHITEROCKS, UT.",40.6166205,-109.9395964,,,,,,,,,,,,,,,,,,,,,,,,,,,,,,,,,,,,,,,,
09299400,"WHITEROCKS R BL DAM SITE NR WHITEROCKS, UT",40.58689879,-109.9276515,,,,,,,,,,,,,,,,,,,,,,,,,,,,,,,,,,,,,,,,
09299500,"WHITEROCKS RIVER NEAR WHITEROCKS, UT",40.5935653,-109.9323739,,,,,,,,,,,,,,,,,,,,,,,,,,,,,,,,,,,,,,,,
09299600,"WHITEROCKS R BL FARM C CANAL NR WHITEROCKS, UT",40.53245498,-109.9232066,,,,,,,,,,,,,,,,,,,,,,,,,,,,,,,,,,,,,,,,
09299700,"WHITEROCKS RIVER 1 MI E OF WHITEROCKS, UT",40.46717827,-109.9140389,,,,,,,,,,,,,,,,,,,,,,,,,,,,,,,,,,,,,,,,
09299900,"DEEP CREEK AT HWY 246 NEAR LAPOINT, UTAH",40.37773645,-109.8215348,,,,,,,,,,,,,,,,,,,,,,,,,,,,,,,,,,,,,,,,
09300000,"DEEP CREEK NEAR LAPOINT, UTAH",40.3332925,-109.8479239,,,,,,,,,,,,,,,,,,,,,,,,,,,,,,,,,,,,,,,,
09300500,"UINTAH RIVER AT FORT DUCHESNE, UTAH",40.3019041,-109.8532013,,,,,,,,,,,,,,,,,,,,,,,,,,,,,,,,,,,,,,,,
09301000,"DRY GULCH NEAR NEOLA, UTAH",40.46384116,-110.1618236,,,,,,,,,,,,,,,,,,,,,,,,,,,,,,,,,,,,,,,,
09301200,"DRY GULCH NR FORT DUCHESNE, UTAH",40.2388496,-109.8523672,,,,,,,,,,,,,,,,,,,,,,,,,,,,,,,,,,,,,,,,
09301500,"UINTA RIVER AT RANDLETT, UT",40.23355686,-109.803777,,,,,,,,,,,,,,,,,,,,,,,,,,,,,,,,,,,,,,,,
09302000,"DUCHESNE RIVER NEAR RANDLETT, UT",40.21027778,-109.7813889,,,,,,,,,,,,,,,,,,,,,,,,,,,,,,,,,,,,,,,,
09306395,"WHITE RIVER NEAR COLORADO STATE LINE, UT",40.01385727,-109.0806682,,,,,,,,,,,,,,,,,,,,,,,,,,,,,,,,,,,,,,,,
09306400,"WHITE RIVER AB HELLS HOLE CANYON NR WATSON, UT",39.973857,-109.1309472,,,,,,,,,,,,,,,,,,,,,,,,,,,,,,,,,,,,,,,,
09306405,HELL'S HOLE CAN AT MOUTH NR WATSON UT,39.9733015,-109.128447,,,,,,,,,,,,,,,,,,,,,,,,,,,,,,,,,,,,,,,,
09306410,"EVACUATION CREEK AB MISSOURI C NR DRAGON, UT",39.79774877,-109.074554,,,,,,,,,,,,,,,,,,,,,,,,,,,,,,,,,,,,,,,,
09306415,"EVACUATION CREEK BL PARK CANYON NR WATSON, UT",39.8483029,-109.1306677,,,,,,,,,,,,,,,,,,,,,,,,,,,,,,,,,,,,,,,,
09306417,"THIMBLE ROCK CANYON NEAR WATSON, UT",39.8249694,-109.1609462,,,,,,,,,,,,,,,,,,,,,,,,,,,,,,,,,,,,,,,,
09306420,EVACUATION CREEK AT WATSON UTAH,39.88274659,-109.1573358,,,,,,,,,,,,,,,,,,,,,,,,,,,,,,,,,,,,,,,,
09306425,"EVACUATION CREEK TRIBUTARY NEAR WATSON, UT",39.8999686,-109.1562249,,,,,,,,,,,,,,,,,,,,,,,,,,,,,,,,,,,,,,,,
09306430,"EVACUATION CREEK NEAR MOUTH NEAR WATSON, UT",39.9521902,-109.1592813,,,,,,,,,,,,,,,,,,,,,,,,,,,,,,,,,,,,,,,,
09306500,"WHITE RIVER NEAR WATSON, UTAH",39.97885629,-109.1787269,,,,,,,,,,,,,,,,,,,,,,,,,,,,,,,,,,,,,,,,
09306600,"WHITE RIVER BL SOUTHAM CANYON NR WATSON, UT",39.9541333,-109.2584518,,,,,,,,,,,,,,,,,,,,,,,,,,,,,,,,,,,,,,,,
09306605,"SOUTHAM CANYON WASH NEAR WATSON, UT",39.9058012,-109.2051156,,,,,,,,,,,,,,,,,,,,,,,,,,,,,,,,,,,,,,,,
09306610,SOUTHAM CAN WASH AT MOUTH NR WATSON UT,39.94718919,-109.235673,,,,,,,,,,,,,,,,,,,,,,,,,,,,,,,,,,,,,,,,
09306620,"ASPHALT WASH BL CENTER FORK NEAR WATSON, UT",39.9071893,-109.2659513,,,,,,,,,,,,,,,,,,,,,,,,,,,,,,,,,,,,,,,,
09306625,"ASPHALT WASH NR MOUTH NR WATSON, UTAH",39.934689,-109.2673408,,,,,,,,,,,,,,,,,,,,,,,,,,,,,,,,,,,,,,,,
09306700,WHITE R BLW ASPHALT WASH NR WATSON UT,39.9255223,-109.2923418,,,,,,,,,,,,,,,,,,,,,,,,,,,,,,,,,,,,,,,,
09306740,"BITTER CREEK ABV DICK CANYON NR WATSON, UT",39.5341397,-109.1003882,,,,,,,,,,,,,,,,,,,,,,,,,,,,,,,,,,,,,,,,
09306760,SWEETWATER CANYON BLW SOUTH CAN NR WATSON UTAH,39.53497085,-109.2231698,,,,,,,,,,,,,,,,,,,,,,,,,,,,,,,,,,,,,,,,
09306780,"SWEETWATER CANYON C NR MOUTH NR WATSON, UT",39.6585795,-109.3334519,,,,,,,,,,,,,,,,,,,,,,,,,,,,,,,,,,,,,,,,
09306800,"BITTER CREEK NEAR BONANZA, UT",39.75330136,-109.3548415,,,,,,,,,,,,,,,,,,,,,,,,,,,,,,,,,,,,,,,,
09306850,"BITTER CREEK AT MOUTH NEAR BONANZA, UT",39.9655212,-109.4170707,,,,,,,,,,,,,,,,,,,,,,,,,,,,,,,,,,,,,,,,
09306870,"SAND WASH NEAR OURAY, UTAH",39.93357656,-109.496796,,,,,,,,,,,,,,,,,,,,,,,,,,,,,,,,,,,,,,,,
09306872,"SAND WASH AT MOUTH NEAR OURAY, UTAH",39.9905206,-109.4867968,,,,,,,,,,,,,,,,,,,,,,,,,,,,,,,,,,,,,,,,
09306878,"COYOTE WASH NEAR MOUTH NEAR OURAY, UT",40.05413137,-109.4773528,,,,,,,,,,,,,,,,,,,,,,,,,,,,,,,,,,,,,,,,
09306880,"NORTH WASH NEAR OURAY, UTAH",40.04663126,-109.5237435,,,,,,,,,,,,,,,,,,,,,,,,,,,,,,,,,,,,,,,,
09306885,"COTTONWOOD WASH NEAR MOUTH NEAR OURAY, UT",40.0557976,-109.6090246,,,,,,,,,,,,,,,,,,,,,,,,,,,,,,,,,,,,,,,,
09306900,WHITE RIVER AT MOUTH NEAR OURAY UTAH,40.0649641,-109.6356923,,,,,,,,,,,,,,,,,,,,,,,,,,,,,,,,,,,,,,,,
09307000,"GREEN RIVER NEAR OURAY, UTAH",40.07218599,-109.7284735,,,,,,,,,,,,,,,,,,,,,,,,,,,,,,,,,,,,,,,,
09307200,"PARIETTE DRAW NEAR OURAY, UTAH",40.08274069,-109.8734784,,,,,,,,,,,,,,,,,,,,,,,,,,,,,,,,,,,,,,,,
09307290,COM F PARIETTE DRAW AT MOUTH AND LAMBS DIV,40.0316309,-109.7520851,,,,,,,,,,,,,,,,,,,,,,,,,,,,,,,,,,,,,,,,
09307295,LAMB DIVERSION FROM PARIETTE DRAW NR OURAY,40.0291309,-109.7570853,,,,,,,,,,,,,,,,,,,,,,,,,,,,,,,,,,,,,,,,
09307300,"PARIETTE DRAW AT MOUTH NEAR OURAY, UTAH",40.0299642,-109.7570853,,,,,,,,,,,,,,,,,,,,,,,,,,,,,,,,,,,,,,,,
09307500,"WILLOW CREEK ABOVE DIVERSIONS NEAR OURAY, UTAH",39.5663541,-109.5873527,,,,,,,,,,,,,,,,,,,,,,,,,,,,,,,,,,,,,,,,
09307800,HILL CR ABV TOWAVE RES NR OURAY UT,39.52579804,-109.7345813,,,,,,,,,,,,,,,,,,,,,,,,,,,,,,,,,,,,,,,,
09307900,"HILL CREEK NR MOUTH NR OURAY, UT",39.876354,-109.7040262,,,,,,,,,,,,,,,,,,,,,,,,,,,,,,,,,,,,,,,,
09308000,"WILLOW CREEK NEAR OURAY, UTAH",39.9388539,-109.648469,,,,,,,,,,,,,,,,,,,,,,,,,,,,,,,,,,,,,,,,
09308500,"MINNIE MAUD CREEK NR MYTON, UTAH",39.798574,-110.565991,,,,,,,,,,,,,,,,,,,,,,,,,,,,,,,,,,,,,,,,
09309000,"MINNIE MAUD C AT NUTTER RANCH NR MYTON, UTAH",39.81246388,-110.2507108,,,,,,,,,,,,,,,,,,,,,,,,,,,,,,,,,,,,,,,,
09309500,"FAIRVIEW DITCH NEAR FAIRVIEW, UTAH",39.6599624,-111.3279582,,,,,,,,,,,,,,,,,,,,,,,,,,,,,,,,,,,,,,,,
09309600,"FAIRVIEW TUNNEL NEAR FAIRVIEW, UT",39.66966944,-111.3133194,,,,,,,,,,,,,,,,,,,,,,,,,,,,,,,,,,,,,,,,
09309800,"GOOSEBERRY CREEK NEAR FAIRVIEW, UTAH",39.674129,-111.304901,,,,,,,,,,,,,,,,,,,,,,,,,,,,,,,,,,,,,,,,
09310000,"GOOSEBERRY CREEK NEAR SCOFIELD, UT",39.7157951,-111.3001788,,,,,,,,,,,,,,,,,,,,,,,,,,,,,,,,,,,,,,,,
09310500,"FISH CREEK ABOVE RESERVOIR, NEAR SCOFIELD, UT",39.77440566,-111.191006,,,,,,,,,,,,,,,,,,,,,,,,,,,,,,,,,,,,,,,,
09310550,"PONTOWN (PONDTOWN) CREEK, NEAR SCOFIELD, UT",39.7830166,-111.1782277,,,,,,,,,,,,,,,,,,,,,,,,,,,,,,,,,,,,,,,,
09310575,BOARDINGHOUSE CR. AT MOUTH SOUTH OF SCOFIELD,39.6499634,-111.1557269,,,,,,,,,,,,,,,,,,,,,,,,,,,,,,,,,,,,,,,,
09310600,"ECCLES CANYON NEAR SCOFIELD, UTAH",39.6852406,-111.1626716,,,,,,,,,,,,,,,,,,,,,,,,,,,,,,,,,,,,,,,,
09310700,"MUD CRK BL WINTER QUARTERS CYN @ SCOFIELD, UT",39.7219111,-111.1615444,,,,,,,,,,,,,,,,,,,,,,,,,,,,,,,,,,,,,,,,
09311000,"SCOFIELD RESERVOIR NEAR SCOFIELD, UT",39.7874611,-111.1257255,,,,,,,,,,,,,,,,,,,,,,,,,,,,,,,,,,,,,,,,
09311500,"PRICE RIVER NEAR SCOFIELD, UTAH",39.78690558,-111.1201697,,,,,,,,,,,,,,,,,,,,,,,,,,,,,,,,,,,,,,,,
09311700,"PRICE RIVER NEAR SOLDIER SUMMIT, UTAH",39.8277383,-111.0090537,,,,,,,,,,,,,,,,,,,,,,,,,,,,,,,,,,,,,,,,
